{
  "$schema": "http://json-schema.org/draft-06/schema#",
  "id": "http://hl7.org/fhir/json-schema/Consent",
  "description": "A record of a healthcare consumer's choices, which permits or denies identified recipient(s) or recipient role(s) to perform one or more actions within a given policy context, for specific purposes and periods of time.",
  "type": "object",
  "required": ["resourceType", "scope", "category"],
  "properties": {
    "resourceType": { "const": "Consent" },
    "id": { "type": "string", "description": "Logical id of this artifact" },
    "_id": { "type": "string", "description": "MongoDB primary key" },
    "meta": { "type": "object", "properties": { "versionId": { "type": "string" }, "lastUpdated": { "type": "string" }, "source": { "type": "string" }, "profile": { "type": "array", "items": { "type": "string" } }, "security": { "type": "array", "items": { "type": "object", "properties": { "system": { "type": "string" }, "code": { "type": "string" }, "display": { "type": "string" } } } }, "tag": { "type": "array", "items": { "type": "object", "properties": { "system": { "type": "string" }, "code": { "type": "string" }, "display": { "type": "string" } } } } } },
    "implicitRules": { "type": "string" },
    "language": { "type": "string" },
    "text": { "type": "object", "properties": { "status": { "type": "string" }, "div": { "type": "string" } } },
    "contained": { "type": "array", "items": { "type": "object" } },
    "extension": { "type": "array", "items": { "type": "object" } },
    "modifierExtension": { "type": "array", "items": { "type": "object" } },
    "identifier": { "type": "array", "items": { "type": "object", "properties": { "use": { "type": "string" }, "system": { "type": "string" }, "value": { "type": "string" } } } },
    "status": { "type": "string", "enum": ["draft", "proposed", "active", "rejected", "inactive", "entered-in-error"] },
    "scope": { "type": "object", "properties": { "coding": { "type": "array", "items": { "type": "object", "properties": { "system": { "type": "string" }, "code": { "type": "string" }, "display": { "type": "string" } } } }, "text": { "type": "string" } } },
    "category": { "type": "array", "items": { "type": "object", "properties": { "coding": { "type": "array", "items": { "type": "object", "properties": { "system": { "type": "string" }, "code": { "type": "string" }, "display": { "type": "string" } } } }, "text": { "type": "string" } } } },
    "patient": { "type": "object", "properties": { "reference": { "type": "string" }, "display": { "type": "string" } } },
    "dateTime": { "type": "string" },
    "performer": { "type": "array", "items": { "type": "object", "properties": { "reference": { "type": "string" }, "display": { "type": "string" } } } },
    "organization": { "type": "array", "items": { "type": "object", "properties": { "reference": { "type": "string" }, "display": { "type": "string" } } } },
    "sourceAttachment": { "type": "object", "properties": { "contentType": { "type": "string" }, "language": { "type": "string" }, "data": { "type": "string" }, "url": { "type": "string" }, "size": { "type": "integer" }, "hash": { "type": "string" }, "title": { "type": "string" }, "creation": { "type": "string" } } },
    "sourceReference": { "type": "object", "properties": { "reference": { "type": "string" }, "display": { "type": "string" } } },
    "policy": { "type": "array", "items": { "type": "object", "properties": { "authority": { "type": "string" }, "uri": { "type": "string" } } } },
    "policyRule": { "type": "object", "properties": { "coding": { "type": "array", "items": { "type": "object", "properties": { "system": { "type": "string" }, "code": { "type": "string" }, "display": { "type": "string" } } } }, "text": { "type": "string" } } },
    "verification": { "type": "array", "items": { "type": "object", "properties": { "verified": { "type": "boolean" }, "verifiedWith": { "type": "object", "properties": { "reference": { "type": "string" }, "display": { "type": "string" } } }, "verificationDate": { "type": "string" } } } },
    "provision": { "type": "object", "properties": { "type": { "type": "string", "enum": ["deny", "permit"] }, "period": { "type": "object", "properties": { "start": { "type": "string" }, "end": { "type": "string" } } }, "actor": { "type": "array", "items": { "type": "object", "properties": { "role": { "type": "object", "properties": { "coding": { "type": "array", "items": { "type": "object", "properties": { "system": { "type": "string" }, "code": { "type": "string" }, "display": { "type": "string" } } } }, "text": { "type": "string" } } }, "reference": { "type": "object", "properties": { "reference": { "type": "string" }, "display": { "type": "string" } } } } } }, "action": { "type": "array", "items": { "type": "object", "properties": { "coding": { "type": "array", "items": { "type": "object", "properties": { "system": { "type": "string" }, "code": { "type": "string" }, "display": { "type": "string" } } } }, "text": { "type": "string" } } } }, "securityLabel": { "type": "array", "items": { "type": "object", "properties": { "system": { "type": "string" }, "code": { "type": "string" }, "display": { "type": "string" } } } }, "purpose": { "type": "array", "items": { "type": "object", "properties": { "system": { "type": "string" }, "code": { "type": "string" }, "display": { "type": "string" } } } }, "class": { "type": "array", "items": { "type": "object", "properties": { "system": { "type": "string" }, "code": { "type": "string" }, "display": { "type": "string" } } } }, "code": { "type": "array", "items": { "type": "object", "properties": { "coding": { "type": "array", "items": { "type": "object", "properties": { "system": { "type": "string" }, "code": { "type": "string" }, "display": { "type": "string" } } } }, "text": { "type": "string" } } } }, "dataPeriod": { "type": "object", "properties": { "start": { "type": "string" }, "end": { "type": "string" } } }, "data": { "type": "array", "items": { "type": "object", "properties": { "meaning": { "type": "string", "enum": ["instance", "related", "dependents", "authoredby"] }, "reference": { "type": "object", "properties": { "reference": { "type": "string" }, "display": { "type": "string" } } } } } }, "provision": { "type": "array", "items": { "type": "object" } } } }
  }
}
