{
  "resourceType": "Consent",
  "id": "ConsentCitizenPublic",
  "meta": {
    "versionId": "1",
    "lastUpdated": "2024-01-01T00:00:00.000Z"
  },
  "text": {
    "status": "generated",
    "div": "<div xmlns=\"http://www.w3.org/1999/xhtml\"><p>Consent for public directory access by citizens</p></div>"
  },
  "status": "active",
  "scope": {
    "coding": [
      {
        "system": "http://terminology.hl7.org/CodeSystem/consentscope",
        "code": "patient-privacy",
        "display": "Privacy Consent"
      }
    ]
  },
  "category": [
    {
      "coding": [
        {
          "system": "http://terminology.hl7.org/CodeSystem/v3-ActCode",
          "code": "IDSCL",
          "display": "information disclosure"
        }
      ]
    }
  ],
  "dateTime": "2024-01-01T00:00:00.000Z",
  "policy": [
    {
      "uri": "https://example.org/policies/public-directory-access"
    }
  ],
  "provision": {
    "type": "permit",
    "actor": [
      {
        "role": {
          "coding": [
            {
              "system": "http://terminology.hl7.org/CodeSystem/v3-RoleClass",
              "code": "CITIZEN",
              "display": "citizen"
            }
          ]
        },
        "reference": {
          "reference": "CitizenRole"
        }
      }
    ],
    "action": [
      {
        "coding": [
          {
            "system": "http://terminology.hl7.org/CodeSystem/consentaction",
            "code": "access",
            "display": "Access"
          }
        ]
      }
    ],
    "securityLabel": [
      {
        "system": "http://terminology.hl7.org/CodeSystem/v3-Confidentiality",
        "code": "N",
        "display": "normal"
      }
    ],
    "class": [
      {
        "code": "Practitioner",
        "display": "Practitioner"
      },
      {
        "code": "PractitionerRole",
        "display": "PractitionerRole"
      },
      {
        "code": "Organization",
        "display": "Organization"
      },
      {
        "code": "Location",
        "display": "Location"
      },
      {
        "code": "HealthcareService",
        "display": "HealthcareService"
      },
      {
        "code": "Endpoint",
        "display": "Endpoint"
      },
      {
        "code": "InsurancePlan",
        "display": "InsurancePlan"
      }
    ]
  }
}